seendate,sourcecountry,domain,title,url
20260629T020000Z,United States,arabic.euronews.com,العلماء يحذرون : فيروس خفي ربما أصاب 9 . 4 مليون شخص .. ومعظم الإصابات لم تُرصد,https://arabic.euronews.com/health/2026/06/29/hidden-virus-infected-94-million-scientists-warn-most-cases-went-undetected
20260705T073000Z,India,bhaskar.com,Indore Heavy Rain Warning | 12 Inch Season Rainfall,https://www.bhaskar.com/local/mp/indore/news/indore-heavy-rain-warning-12-inch-season-so-far-138365232.html
20260705T153000Z,India,prokerala.com,Measles outbreak in Bangladesh claims seven more lives ; death toll rises to 738,https://www.prokerala.com/news/articles/a1784136.html
20260710T123000Z,Nigeria,allafrica.com,Sudan : New Cholera Outbreak Alert for Sudan War - Weary Communities,https://allafrica.com/stories/202607100404.html
20260719T051500Z,Australia,watoday.com.au,Mosquito alarm : AI device detecting the world deadliest creature,https://www.watoday.com.au/national/nsw/the-device-detecting-the-world-s-deadliest-creature-20260715-p60fm4.html
20260717T133000Z,United States,legalinsurrection.com,Report : Taco Bell Lettuce Supplier Identified as Possible Source of Cyclosporiasis Outbreak,https://legalinsurrection.com/2026/07/report-taco-bell-lettuce-supplier-identified-as-possible-source-of-cyclosporiasis-outbreak/
20260713T184500Z,India,jagran.com,"सर्विस लेन का सीवर जाम : दो महीने से राधे कृष्ण अपार्टमेंट में भरा पानी , बीमारी के साए में जीने को मजबूर लोग - dwarka radhe krishna apartment sewer jam 2 months of overflow health risks",https://www.jagran.com/delhi/new-delhi-city-dwarka-radhe-krishna-apartment-sewer-jam-2-months-of-overflow-health-risks-40305557.html
20260626T200000Z,Belize,sanpedrosun.com,Authorities Begin Fogging Campaign to Prevent Mosquito - Borne Illnesses,https://www.sanpedrosun.com/health/2026/06/26/authorities-begin-fogging-campaign-to-prevent-mosquito-borne-illnesses/
20260621T141500Z,India,haribhoomi.com,"मानसून में रहें फिट और हेल्दी : इन आसान उपायों से बीमारियां रहेंगी दूर , नहीं रहेगी सेहत की चिंता !",https://www.haribhoomi.com/lifestyle/news/best-ways-to-stay-healthy-during-monsoon-season-100780
20260716T203000Z,Germany,az-online.de,Dengue - Fall in Italien - Küstenstadt : Behörden starten Notfall - Desinfektion rund um Krankenhaus,http://www.az-online.de/welt/dengue-fall-in-italien-kuestenstadt-behoerden-sperren-park-und-starten-notfall-desinfektion-rund-um-krankenhaus-zr-94401292.html
20260716T204500Z,Germany,az-online.de,Dengue - Fall in Italien - Küstenstadt : Behörden starten Notfall - Desinfektion rund um Krankenhaus,https://www.az-online.de/welt/dengue-fall-in-italien-kuestenstadt-behoerden-sperren-park-und-starten-notfall-desinfektion-rund-um-krankenhaus-zr-94401292.html
20260630T160000Z,Syria,sana.sy,الجهود الدولية تتكثّف لمساعدة فنزويلا وسط تحذيرات من انهيار النظام الصحي بعد الزلزالين,https://sana.sy/international/2515328/
20260715T174500Z,France,linternaute.com,La Coupe du monde de foot  crée les conditions parfaites pour que des maladies se propagent    : quels sont les risques  ?,https://www.linternaute.com/sante/id/10662176-article-coupe-monde-foot-risques-sante/
20260621T230000Z,Cuba,cubaheadlines.com,Havana Unhealthy Norm : Food Sales Amid Piles of Garbage,https://www.cubaheadlines.com/articles/332978
20260627T081500Z,India,timesofindia.indiatimes.com,Uk Mosquitoes : Mosquitoes in the united kingdom heatwaves : 7 ways to keep your home mosquito - safe and protect yourself,https://timesofindia.indiatimes.com/etimes/trending/mosquitoes-in-the-uk-doctors-issue-warning-amid-uk-heatwaves-7-ways-to-keep-your-home-mosquito-safe-and-protect-yourself/articleshow/132030663.cms
20260718T144500Z,Yemen,alwahdawi.net,خارطة أوبئة تضغط على منظومة صحية منهكة في اليمن,https://alwahdawi.net/news-38569
20260714T203000Z,United States,forbes.com,Possible Role Of Climate Change In Current Cyclosporiasis Outbreak,https://www.forbes.com/sites/joshuacohen/2026/07/14/possible-role-of-climate-change-in-current-cyclosporiasis-outbreak/
20260622T170000Z,Italy,sardanews.it,"Epis ( Statale Milano ):  Dopo un inverno mite tante zanzare e in anticipo , favorite dal meteo",https://sardanews.it/notizie/epis-statale-milano-dopo-un-inverno-mite-tante-zanzare-e-in-anticipo-favorite-dal-meteo
20260708T080000Z,India,hindi.oneindia.com,मानसून में तेजी लेकिन जुलाई में 12 प्रतिशत घटी बारिश की रफ्तार,https://hindi.oneindia.com/news/india/rainfall-deficit-reduces-to-12-per-cent-in-july-011-1604181.html
20260622T173000Z,Nigeria,tribuneonlineng.com,Africa health future hinges on data sovereignty in AI era – Expert,https://tribuneonlineng.com/africas-health-future-hinges-on-data-sovereignty-in-ai-era-expert/
20260709T141500Z,Italy,gazzetta.it,"Zecche , zanzare e virus : lavvertimento di Bassetti su tutti i rischi",https://www.gazzetta.it/salute/09-07-2026/zecche-zanzare-e-virus-l-avvertimento-di-bassetti-su-tutti-i-rischi.shtml
20260710T173000Z,Nigeria,fr.allafrica.com,Soudan : Le choléra frappe des populations déjà ravagées par la guerre,https://fr.allafrica.com/stories/202607100531.html
20260709T043000Z,Cuba,cubaheadlines.com,Waste and Sewage in Havana Streets Endanger Cuban Food Security,https://www.cubaheadlines.com/articles/334586
20260629T210000Z,United States,thevermilion.com,The tiger mosquito and dengue contagion in Italy : plan for  bomb  males under X - rays ( after the case in Bologna ),https://www.thevermilion.com/the-tiger-mosquito-and-dengue-contagion-in-italy-plan-for-bomb-males-under-x-rays-after-the-case-in-bologna/article_18822/
20260709T070000Z,India,khaskhabar.com,"Heavy Rain Exposes Noida Infrastructure Woes ; City Roads and Sectors Waterlogged , Noida News in Hindi",https://www.khaskhabar.com/local/uttar-pradesh/noida-news/news-heavy-rain-exposes-noida-infrastructure-woes-city-roads-and-sectors-waterlogged-news-hindi-1-827500-KKN.html
20260624T174500Z,Bangladesh,jugantor.com,সরকার নারীর স্বাস্থ্যকে বিশেষ অগ্রাধিকার দিচ্ছে,https://www.jugantor.com/national/1118211
20260718T144500Z,India,punjabkesari.com,"White House Statement On Iran :  सीजफायर तोड़ने का अंजाम भुगतना पड़ेगा , बातचीत से कुछ ...., ट्रंप ने फिर ईरान को वार्निंग",https://www.punjabkesari.com/world-news/white-house-statement-on-iran-consequences-for-breaking-the-ceasefire-talks-might-yield-something-trump-warns-iran-again/
20260630T150000Z,United States,wsls.com,"Aid workers warn of infectious diseases , overwhelmed hospitals after Venezuela quakes",https://www.wsls.com/news/world/2026/06/30/aid-workers-warn-of-infectious-diseases-overwhelmed-hospitals-after-venezuela-quakes/
20260630T050000Z,United States,click2houston.com,Tejano singer warns of West Nile dangers after mosquito bite leaves him in wheelchair,https://www.click2houston.com/news/local/2026/06/30/what-if-i-would-have-used-repellent-tejano-singer-warns-of-west-nile-dangers-after-mosquito-bite-leaves-him-in-wheel/
20260718T111500Z,India,thehitavada.com,Lull in monsoon leads to mosquito menace in city,https://www.thehitavada.com/Encyc/2026/7/18/lull-in-monsoon-leads-to-mosquito-menace-in-city.html
20260630T180000Z,Jamaica,jamaica-gleaner.com,"Aid workers warn of infectious diseases , overwhelmed hospitals after Venezuela quakes",https://jamaica-gleaner.com/article/world-news/20260630/aid-workers-warn-infectious-diseases-overwhelmed-hospitals-after
20260713T141500Z,Italy,notizie.it,"Il ritorno della West Nile , Maggi ( Spallanzani ):  Primo caso nel Lazio non sarà unico ma sorveglianza funziona",https://www.notizie.it/il-ritorno-della-west-nile-maggi-spallanzani-primo-caso-nel-lazio-non-sara-unico-ma-sorveglianza-funziona/
20260716T203000Z,Germany,kreiszeitung.de,Dengue - Fall in Italien - Küstenstadt : Behörden starten Notfall - Desinfektion rund um Krankenhaus,https://www.kreiszeitung.de/welt/dengue-fall-in-italien-kuestenstadt-behoerden-sperren-park-und-starten-notfall-desinfektion-rund-um-krankenhaus-zr-94401292.html
20260716T220000Z,Germany,wlz-online.de,Dengue - Fall in Italien - Küstenstadt : Behörden starten Notfall - Desinfektion rund um Krankenhaus,http://www.wlz-online.de/panorama/dengue-fall-in-italien-kuestenstadt-behoerden-sperren-park-und-starten-notfall-desinfektion-rund-um-krankenhaus-zr-94401292.html
20260716T214500Z,Germany,kreisbote.de,Dengue - Fall in Italien - Küstenstadt : Behörden starten Notfall - Desinfektion rund um Krankenhaus,http://www.kreisbote.de/welt/dengue-fall-in-italien-kuestenstadt-behoerden-sperren-park-und-starten-notfall-desinfektion-rund-um-krankenhaus-zr-94401292.html
20260716T204500Z,Spain,costanachrichten.com,Dengue - Fall in Italien - Küstenstadt : Behörden starten Notfall - Desinfektion rund um Krankenhaus,http://www.costanachrichten.com/panorama/dengue-fall-in-italien-kuestenstadt-behoerden-sperren-park-und-starten-notfall-desinfektion-rund-um-krankenhaus-zr-94401292.html
20260714T170000Z,Taiwan,taipeitimes.com,CDC confirms this year first Zika virus infection,https://www.taipeitimes.com/News/taiwan/archives/2026/07/15/2003860777
20260630T180000Z,United States,ksat.com,"Aid workers warn of infectious diseases , overwhelmed hospitals after Venezuela quakes",https://www.ksat.com/news/world/2026/06/30/aid-workers-warn-of-infectious-diseases-overwhelmed-hospitals-after-venezuela-quakes/
20260630T160000Z,United States,bostonherald.com,Aid workers warn of infectious diseases after Venezuela quakes,https://www.bostonherald.com/2026/06/30/venezuela-earthquakes-infectious-disease-overwhelmed-hospitals/
20260630T191500Z,United States,click2houston.com,"Aid workers warn of infectious diseases , overwhelmed hospitals after Venezuela quakes",https://www.click2houston.com/news/world/2026/06/30/aid-workers-warn-of-infectious-diseases-overwhelmed-hospitals-after-venezuela-quakes/
20260630T164500Z,United Kingdom,echo-news.co.uk,Warnings of infectious diseases and overwhelmed hospitals after Venezuela quakes,https://www.echo-news.co.uk/news/national/26242139.warnings-infectious-diseases-overwhelmed-hospitals-venezuela-quakes/
20260708T181500Z,United States,miragenews.com,Chikungunya Fever : TCM Role in Evidence - Based Care,https://www.miragenews.com/chikungunya-fever-tcms-role-in-evidence-based-1706948/
20260708T094500Z,India,thehindu.com,Health Matters newsletter : What happens when your disease isnt simple ?,https://www.thehindu.com/sci-tech/health/health-matters-newsletter-what-happens-when-your-disease-isnt-simple/article71192513.ece
20260630T190000Z,United States,somdnews.com,"Aid workers warn of infectious diseases , overwhelmed hospitals after Venezuela quakes",http://www.somdnews.com/ap/world/aid-workers-warn-of-infectious-diseases-overwhelmed-hospitals-after-venezuela-quakes/article_767f7864-7ca0-5dae-aaf8-16b5450fb91c.html
20260630T184500Z,United States,isp.netscape.com,"Aid workers warn of infectious diseases , overwhelmed hospitals after Venezuela quakes",https://isp.netscape.com:443/news/world/story/0001/20260630/de59847a5afb28f799d693501f2385aa
20260630T164500Z,Canada,thepeterboroughexaminer.com,"Aid workers warn of infectious diseases , overwhelmed hospitals after Venezuela quakes",https://www.thepeterboroughexaminer.com/life/health-wellness/aid-workers-warn-of-infectious-diseases-overwhelmed-hospitals-after-venezuela-quakes/article_430f618c-e12d-54df-9adf-ee03d9fe4756.html
20260629T054500Z,Bangladesh,thedailystar.net,Dhaka Waterbodies : The Cost of Unplanned Urbanisation,https://www.thedailystar.net/slow-reads/big-picture/news/how-dhaka-can-restore-its-natural-cooling-system-4209531
20260630T183000Z,United Kingdom,theargus.co.uk,Warnings of infectious diseases and overwhelmed hospitals after Venezuela quakes,https://www.theargus.co.uk/news/national/26242139.warnings-infectious-diseases-overwhelmed-hospitals-venezuela-quakes/
20260627T134500Z,India,ianslive.in,"Bangladesh measles outbreak claims seven more lives , death toll rises to 709",https://ianslive.in/bangladesh-measles-outbreak-claims-seven-more-lives-death-toll-rises-to-709--20260627175735
20260708T090000Z,India,hindi.moneycontrol.com,"El Nino Impact : अल नीनो के खतरे पर PMO में हाई लेवल मीटिंग , खेती - जॉब से खाने - पीने के सामान तक अंदर से निकल कर आईं ये 5 बातें जानिए",https://hindi.moneycontrol.com/india/el-nino-impact-high-level-meeting-in-pmo-regarding-el-nino-threat-5-key-things-to-know-from-agriculture-and-jobs-to-food-items-article-2417879.html
20260716T151500Z,Cyprus,cyprus-mail.com,Govt assures mosquito sterilisation  effective  despite Larnaca outbreak,https://cyprus-mail.com/2026/07/16/govt-assures-mosquito-sterilisation-effective-despite-larnaca-outbreak
20260630T174500Z,United Kingdom,ipswichstar.co.uk,Warnings of infectious diseases and overwhelmed hospitals after Venezuela quakes,https://www.ipswichstar.co.uk/news/national/26242139.warnings-infectious-diseases-overwhelmed-hospitals-venezuela-quakes/
20260630T174500Z,United Kingdom,theboltonnews.co.uk,Warnings of infectious diseases and overwhelmed hospitals after Venezuela quakes,https://www.theboltonnews.co.uk/news/national/26242139.warnings-infectious-diseases-overwhelmed-hospitals-venezuela-quakes/
20260705T084500Z,Bangladesh,mzamin.com,জুলাই হত্যা মামলায় হ - য - ব - র - ল,https://www.mzamin.com/article/26405
20260624T093000Z,United States,wjhg.com,We Will Not Let Them Buzz Out of Control !,https://www.wjhg.com/sponsored/beach-mosquito-control-district/we-will-not-let-them-buzz-out-control/
20260716T023000Z,China,chinatechnews.com,Will Hasina Return to Bangladesh ? - ChinaTechNews . com,https://www.chinatechnews.com/2026/07/16/125638-will-hasina-return-to-bangladesh
20260623T061500Z,Italy,padovanews.it,"Epis ( Statale Milano ):  Dopo un inverno mite tante zanzare e in anticipo , favorite dal meteo  – Padovanews",https://www.padovanews.it/2026/06/23/epis-statale-milano-dopo-un-inverno-mite-tante-zanzare-e-in-anticipo-favorite-dal-meteo/
20260625T060000Z,United States,foreignpolicy.com,Will Pakistan Iran War Mediation Gamble Pay Off ?,https://foreignpolicy.com/2026/06/24/pakistan-iran-deal-war-mediation-middle-east/
20260625T130000Z,United States,foreignpolicy.com,Will Pakistan Iran War Mediation Gamble Pay Off ?,https://foreignpolicy.com/2026/06/24/pakistan-iran-deal-war-mediation-middle-east/?tpcc=recirc_trending062921
20260716T214500Z,France,futura-sciences.com,Ennemi public numéro 1 : pourquoi faire disparaître le moustique pourrait se retourner contre nous,https://www.futura-sciences.com/sante/actualites/moustique-ennemi-public-numero-1-faire-disparaitre-moustique-pourrait-retourner-nous-136030/
20260720T124500Z,Nigeria,opinionnigeria.com,"WHO Mediterranean Office calls for $6 . 42 million to sustain health and nutrition services across Somalia , Sudan and Djibouti - By Kelvin Kwame Dewey",https://www.opinionnigeria.com/who-mediterranean-office-calls-for-6-42-million-to-sustain-health-and-nutrition-services-across-somalia-sudan-and-djibouti-by-kelvin-kwame-dewey/
20260710T144500Z,South Africa,africa-newsroom.com,APO Group - Africa Newsroom / Press release | New cholera outbreak alert for Sudan war - weary communities,https://www.africa-newsroom.com/press/new-cholera-outbreak-alert-for-sudans-warweary-communities
20260717T064500Z,United States,wsws.org,Catastrophic Bangladesh floods kill over 50 people,https://www.wsws.org/en/articles/2026/07/17/xtoo-j17.html
20260705T074500Z,,en.tempo.co,Fact Check : Was Hantavirus Created for Global Elite Profits ?,https://en.tempo.co/read/2111989/fact-check-was-hantavirus-created-for-global-elite-profits
20260630T153000Z,Bangladesh,suprobhat.com,ঝুঁকিতে লাখো রোহিঙ্গা : বর্ষার প্রাক্কালে প্রয়োজন জরুরি ও দীর্ঘমেয়াদি পদক্ষেপ,https://suprobhat.com/%E0%A6%9D%E0%A7%81%E0%A6%81%E0%A6%95%E0%A6%BF%E0%A6%A4%E0%A7%87-%E0%A6%B2%E0%A6%BE%E0%A6%96%E0%A7%8B-%E0%A6%B0%E0%A7%8B%E0%A6%B9%E0%A6%BF%E0%A6%99%E0%A7%8D%E0%A6%97%E0%A6%BE-%E0%A6%AC%E0%A6%B0/
20260719T223000Z,Libya,libyaakhbar.com,من  جمهورية الموز  إلى  مقبرة الضمير .. كيف يحوّل الفاسدون النفط الليبي إلى سراب ؟,https://www.libyaakhbar.com/libya-news/2838407.html
20260624T051500Z,China,mp.cnfol.com,淘气天尊 ： 医药爆发的三重逻辑 ！_ 中金在线财经号,http://mp.cnfol.com/34169/article/1782273502-142513067.html
20260717T064500Z,China,hy.stock.cnfol.com,新冠叠加流感 ， 市民常备香雪抗病毒口服液等药物 _ 产业资讯 _ 行业 _ 中金在线,http://hy.stock.cnfol.com/hangyejingcui/20260717/32310135.shtml
20260630T181500Z,United Kingdom,dorsetecho.co.uk,Warnings of infectious diseases and overwhelmed hospitals after Venezuela quakes,https://www.dorsetecho.co.uk/news/national/26242139.warnings-infectious-diseases-overwhelmed-hospitals-venezuela-quakes/
20260629T041500Z,Germany,ovb-online.de,Wie gefährlich sind die neuen Seuchen für Rosenheim ?,http://www.ovb-online.de/rosenheim/landkreis/wie-gefaehrlich-sind-die-neuen-seuchen-fuer-rosenheim-94367169.html
20260630T180000Z,United Kingdom,yourlocalguardian.co.uk,Warnings of infectious diseases and overwhelmed hospitals after Venezuela quakes,https://www.yourlocalguardian.co.uk/news/national/26242139.warnings-infectious-diseases-overwhelmed-hospitals-venezuela-quakes/
20260630T180000Z,United States,cecildaily.com,"Aid workers warn of infectious diseases , overwhelmed hospitals after Venezuela quakes",http://www.cecildaily.com/ap/world/aid-workers-warn-of-infectious-diseases-overwhelmed-hospitals-after-venezuela-quakes/article_f07d0e6e-54e6-5648-80a4-401d04d49577.html
20260630T184500Z,United States,stardem.com,"Aid workers warn of infectious diseases , overwhelmed hospitals after Venezuela quakes",http://www.stardem.com/ap/world/aid-workers-warn-of-infectious-diseases-overwhelmed-hospitals-after-venezuela-quakes/article_dc19eb18-20ed-5c8a-8155-b2861830db30.html
20260707T174500Z,India,deshbandhu.co.in,"अल नीनो के संभावित असर को लेकर पीएमओ की उच्चस्तरीय समीक्षा बैठक , तैयारियों का लिया गया जायजा",https://www.deshbandhu.co.in/delhi/pmo-holds-high-level-review-meeting-on-potential-impact-of-el-nio-preparedness-assessed-308728
20260713T183000Z,United States,ipsnews.net,UN Raises Alarm Over A Sharp Rise in Human Rights Abuses and Cholera - Related Deaths in Sudan,https://www.ipsnews.net/2026/07/un-raises-alarm-over-a-sharp-rise-in-human-rights-abuses-and-cholera-related-deaths-in-sudan/
20260713T234500Z,Italy,padovanews.it,"Il ritorno della West Nile , Maggi ( Spallanzani ):  Primo caso nel Lazio non sarà unico ma sorveglianza funziona  – Padovanews",https://www.padovanews.it/2026/07/13/il-ritorno-della-west-nile-maggi-spallanzani-primo-caso-nel-lazio-non-sara-unico-ma-sorveglianza-funziona/
20260706T163000Z,Canada,torontotelegraph.com,"As the Ebola Epidemic Spreads , NanoViricides Advances Towards a Phase II Clinical Trial of NV - 387 Oral Gummies as a Treatment for Ebola in DR Congo",http://www.torontotelegraph.com/news/279170328/as-the-ebola-epidemic-spreads-nanoviricides-advances-towards-a-phase-ii-clinical-trial-of-nv-387-oral-gummies-as-a-treatment-for-ebola-in-dr-congo
20260706T131500Z,United States,tennesseedaily.com,"As the Ebola Epidemic Spreads , NanoViricides Advances Towards a Phase II Clinical Trial of NV - 387 Oral Gummies as a Treatment for Ebola in DR Congo",http://www.tennesseedaily.com/news/279170328/as-the-ebola-epidemic-spreads-nanoviricides-advances-towards-a-phase-ii-clinical-trial-of-nv-387-oral-gummies-as-a-treatment-for-ebola-in-dr-congo
20260713T180000Z,United States,newjerseytelegraph.com,"As Ebola Spreads in Two More Provinces , NanoViricides Has Received National Ethics Committee Approval for a Phase II Clinical Trial of NV - 387 Oral Gummies as a Treatment for Ebola in Congo",http://www.newjerseytelegraph.com/news/279184723/as-ebola-spreads-in-two-more-provinces-nanoviricides-has-received-national-ethics-committee-approval-for-a-phase-ii-clinical-trial-of-nv-387-oral-gummies-as-a-treatment-for-ebola-in-congo
20260713T140000Z,United States,tennesseedaily.com,"As Ebola Spreads in Two More Provinces , NanoViricides Has Received National Ethics Committee Approval for a Phase II Clinical Trial of NV - 387 Oral Gummies as a Treatment for Ebola in Congo",http://www.tennesseedaily.com/news/279184723/as-ebola-spreads-in-two-more-provinces-nanoviricides-has-received-national-ethics-committee-approval-for-a-phase-ii-clinical-trial-of-nv-387-oral-gummies-as-a-treatment-for-ebola-in-congo
20260713T170000Z,United States,hawaiitelegraph.com,"As Ebola Spreads in Two More Provinces , NanoViricides Has Received National Ethics Committee Approval for a Phase II Clinical Trial of NV - 387 Oral Gummies as a Treatment for Ebola in Congo",http://www.hawaiitelegraph.com/news/279184723/as-ebola-spreads-in-two-more-provinces-nanoviricides-has-received-national-ethics-committee-approval-for-a-phase-ii-clinical-trial-of-nv-387-oral-gummies-as-a-treatment-for-ebola-in-congo
20260630T173000Z,United States,union-bulletin.com,"Aid workers warn of infectious diseases , overwhelmed hospitals after Venezuela quakes",https://www.union-bulletin.com/news/world/aid-workers-warn-of-infectious-diseases-overwhelmed-hospitals-after-venezuela-quakes/article_f0f64bc9-c419-5538-98ae-253216c15050.html
20260630T164500Z,United Kingdom,richmondandtwickenhamtimes.co.uk,Warnings of infectious diseases and overwhelmed hospitals after Venezuela quakes,https://www.richmondandtwickenhamtimes.co.uk/news/national/26242139.warnings-infectious-diseases-overwhelmed-hospitals-venezuela-quakes/
20260630T173000Z,United States,rockymounttelegram.com,"Aid workers warn of infectious diseases , overwhelmed hospitals after Venezuela quakes",http://www.rockymounttelegram.com/news/world/aid-workers-warn-of-infectious-diseases-overwhelmed-hospitals-after-venezuela-quakes/article_952b75b5-a5e8-556d-a65c-0ba23dbdb254.html
20260630T173000Z,,countypress.co.uk,Warnings of infectious diseases and overwhelmed hospitals after Venezuela quakes,https://www.countypress.co.uk/news/national/26242139.warnings-infectious-diseases-overwhelmed-hospitals-venezuela-quakes/
20260630T180000Z,United States,wmnf.org,"Venezuela Earthquake Live Updates : June 30 , 2026",https://www.wmnf.org/venezuela-earthquake-live-updates-june-30-2026/
20260713T133000Z,Pakistan,arynews.tv,"As Pakistan monsoon arrives , people with HIV worry",https://arynews.tv/pakistan-monsoon-hiv-problem
20260711T210000Z,Cuba,cubaheadlines.com,Havana Sanitation Crisis : A Return to Colonial Era Filth,https://www.cubaheadlines.com/articles/334809
20260630T173000Z,United Kingdom,clactonandfrintongazette.co.uk,Warnings of infectious diseases and overwhelmed hospitals after Venezuela quakes,https://www.clactonandfrintongazette.co.uk/news/national/26242139.warnings-infectious-diseases-overwhelmed-hospitals-venezuela-quakes/
20260630T180000Z,United Kingdom,leighjournal.co.uk,Warnings of infectious diseases and overwhelmed hospitals after Venezuela quakes,https://www.leighjournal.co.uk/news/national/26242139.warnings-infectious-diseases-overwhelmed-hospitals-venezuela-quakes/
20260630T181500Z,United Kingdom,wharfedaleobserver.co.uk,Warnings of infectious diseases and overwhelmed hospitals after Venezuela quakes,https://www.wharfedaleobserver.co.uk/news/national/26242139.warnings-infectious-diseases-overwhelmed-hospitals-venezuela-quakes/
20260630T181500Z,United Kingdom,gazetteandherald.co.uk,Warnings of infectious diseases and overwhelmed hospitals after Venezuela quakes,https://www.gazetteandherald.co.uk/news/national/26242139.warnings-infectious-diseases-overwhelmed-hospitals-venezuela-quakes/
20260630T174500Z,United Kingdom,eveshamjournal.co.uk,Warnings of infectious diseases and overwhelmed hospitals after Venezuela quakes,https://www.eveshamjournal.co.uk/news/national/26242139.warnings-infectious-diseases-overwhelmed-hospitals-venezuela-quakes/
20260630T174500Z,United Kingdom,basingstokegazette.co.uk,Warnings of infectious diseases and overwhelmed hospitals after Venezuela quakes,https://www.basingstokegazette.co.uk/news/national/26242139.warnings-infectious-diseases-overwhelmed-hospitals-venezuela-quakes/
20260630T174500Z,United Kingdom,ludlowadvertiser.co.uk,Warnings of infectious diseases and overwhelmed hospitals after Venezuela quakes,https://www.ludlowadvertiser.co.uk/news/national/26242139.warnings-infectious-diseases-overwhelmed-hospitals-venezuela-quakes/
20260630T174500Z,United Kingdom,stroudnewsandjournal.co.uk,Warnings of infectious diseases and overwhelmed hospitals after Venezuela quakes,https://www.stroudnewsandjournal.co.uk/news/national/26242139.warnings-infectious-diseases-overwhelmed-hospitals-venezuela-quakes/
